Id,info
222," В, С, М, белое перо или сердце курицы"
223," В, С, М, кусочек губки"
224," В, С, М, порошок рубина, стоящий 1 500 зм"
225," В, С, М, мех или перо зверя"
226," В, С, М, стружка корня лакрицы"
227," В, С, М, щепотка мелкого песка, лепестки розы или сверчок"
228," В, С, М, песочные часы, наполненные алмазной пылью стоимостью не менее 5000 зм, поглощаемые заклинанием"
229," В, С, М, раздвоенный металлический прут, стоящий как минимум 250 зм, настроенный на конкретный план существования"
230," В, С, М, огонь и святая вода"
231," В, С, М, кусочек пробки"
232," В, С, М, святой символ, стоимостью не менее 5 зм"
233," В, С, М, алмаз, стоящий как минимум 50 зм"
234," В, С, М, шарик из черного мрамора"
235," В, С, М, порошок серебра стоимостью  25 зм, расходуемый заклинанием"
236," В, С, М, ветка омелы"
237," В, С, М, семь острых шипов или семь заострённых веточек"
238," В, С, М, небольшой пергамент со святыми письменами"
239," В, С, М, кусочек щупальца гигантского осьминога или гигантского кальмара"
240," В, М, маленькая глиняная модель зиккурата"
